{
  "schemaVersion": "1",
  "observedAt": "2026-08-23T12:18:43.630Z",
  "currency": "USD",
  "unitTokens": 1000000,
  "providers": [
    {
      "id": "openai",
      "label": "OpenAI"
    },
    {
      "id": "anthropic",
      "label": "Anthropic"
    },
    {
      "id": "google",
      "label": "Google"
    },
    {
      "id": "xai",
      "label": "xAI"
    },
    {
      "id": "deepseek",
      "label": "DeepSeek"
    },
    {
      "id": "kimi",
      "label": "Kimi / Moonshot AI"
    },
    {
      "id": "qwen",
      "label": "Qwen / Alibaba Cloud"
    },
    {
      "id": "mistral",
      "label": "Mistral AI"
    },
    {
      "id": "cohere",
      "label": "Cohere"
    }
  ],
  "models": [
    {
      "id": "openai:gpt-5.6-sol:standard:short",
      "modelId": "gpt-5.6-sol",
      "provider": "openai",
      "providerLabel": "OpenAI",
      "label": "GPT-5.6 Sol",
      "tierLabel": "Standard · up to 272K input",
      "inputPerMillionUsd": 5,
      "cachedInputPerMillionUsd": 0.5,
      "cacheWritePerMillionUsd": 6.25,
      "outputPerMillionUsd": 30,
      "contextWindowTokens": 1050000,
      "maxInputTokensInclusive": 272000,
      "region": "Global",
      "sourceUrl": "https://developers.openai.com/api/docs/pricing",
      "sourceLabel": "OpenAI API pricing"
    },
    {
      "id": "openai:gpt-5.6-sol:standard:long",
      "modelId": "gpt-5.6-sol",
      "provider": "openai",
      "providerLabel": "OpenAI",
      "label": "GPT-5.6 Sol",
      "tierLabel": "Standard · over 272K input",
      "inputPerMillionUsd": 10,
      "cachedInputPerMillionUsd": 1,
      "cacheWritePerMillionUsd": 12.5,
      "outputPerMillionUsd": 45,
      "contextWindowTokens": 1050000,
      "minInputTokensExclusive": 272000,
      "maxInputTokensInclusive": 1050000,
      "region": "Global",
      "sourceUrl": "https://developers.openai.com/api/docs/pricing",
      "sourceLabel": "OpenAI API pricing"
    },
    {
      "id": "openai:gpt-5.6-terra:standard:short",
      "modelId": "gpt-5.6-terra",
      "provider": "openai",
      "providerLabel": "OpenAI",
      "label": "GPT-5.6 Terra",
      "tierLabel": "Standard · up to 272K input",
      "inputPerMillionUsd": 2,
      "cachedInputPerMillionUsd": 0.2,
      "cacheWritePerMillionUsd": 2.5,
      "outputPerMillionUsd": 12,
      "contextWindowTokens": 1050000,
      "maxInputTokensInclusive": 272000,
      "region": "Global",
      "sourceUrl": "https://developers.openai.com/api/docs/pricing",
      "sourceLabel": "OpenAI API pricing"
    },
    {
      "id": "openai:gpt-5.6-terra:standard:long",
      "modelId": "gpt-5.6-terra",
      "provider": "openai",
      "providerLabel": "OpenAI",
      "label": "GPT-5.6 Terra",
      "tierLabel": "Standard · over 272K input",
      "inputPerMillionUsd": 4,
      "cachedInputPerMillionUsd": 0.4,
      "cacheWritePerMillionUsd": 5,
      "outputPerMillionUsd": 18,
      "contextWindowTokens": 1050000,
      "minInputTokensExclusive": 272000,
      "maxInputTokensInclusive": 1050000,
      "region": "Global",
      "sourceUrl": "https://developers.openai.com/api/docs/pricing",
      "sourceLabel": "OpenAI API pricing"
    },
    {
      "id": "openai:gpt-5.6-luna:standard:short",
      "modelId": "gpt-5.6-luna",
      "provider": "openai",
      "providerLabel": "OpenAI",
      "label": "GPT-5.6 Luna",
      "tierLabel": "Standard · up to 272K input",
      "inputPerMillionUsd": 0.2,
      "cachedInputPerMillionUsd": 0.02,
      "cacheWritePerMillionUsd": 0.25,
      "outputPerMillionUsd": 1.2,
      "contextWindowTokens": 1050000,
      "maxInputTokensInclusive": 272000,
      "region": "Global",
      "sourceUrl": "https://developers.openai.com/api/docs/pricing",
      "sourceLabel": "OpenAI API pricing"
    },
    {
      "id": "openai:gpt-5.6-luna:standard:long",
      "modelId": "gpt-5.6-luna",
      "provider": "openai",
      "providerLabel": "OpenAI",
      "label": "GPT-5.6 Luna",
      "tierLabel": "Standard · over 272K input",
      "inputPerMillionUsd": 0.4,
      "cachedInputPerMillionUsd": 0.04,
      "cacheWritePerMillionUsd": 0.5,
      "outputPerMillionUsd": 1.8,
      "contextWindowTokens": 1050000,
      "minInputTokensExclusive": 272000,
      "maxInputTokensInclusive": 1050000,
      "region": "Global",
      "sourceUrl": "https://developers.openai.com/api/docs/pricing",
      "sourceLabel": "OpenAI API pricing"
    },
    {
      "id": "anthropic:claude-fable-5:standard",
      "modelId": "claude-fable-5",
      "provider": "anthropic",
      "providerLabel": "Anthropic",
      "label": "Claude Fable 5",
      "tierLabel": "Standard",
      "inputPerMillionUsd": 10,
      "cachedInputPerMillionUsd": 1,
      "cacheWritePerMillionUsd": 12.5,
      "cacheWriteOneHourPerMillionUsd": 20,
      "outputPerMillionUsd": 50,
      "contextWindowTokens": 1000000,
      "region": "Global routing",
      "sourceUrl": "https://platform.claude.com/docs/en/about-claude/pricing",
      "sourceLabel": "Claude API pricing"
    },
    {
      "id": "anthropic:claude-opus-5:standard",
      "modelId": "claude-opus-5",
      "provider": "anthropic",
      "providerLabel": "Anthropic",
      "label": "Claude Opus 5",
      "tierLabel": "Standard",
      "inputPerMillionUsd": 5,
      "cachedInputPerMillionUsd": 0.5,
      "cacheWritePerMillionUsd": 6.25,
      "cacheWriteOneHourPerMillionUsd": 10,
      "outputPerMillionUsd": 25,
      "contextWindowTokens": 1000000,
      "region": "Global routing",
      "sourceUrl": "https://platform.claude.com/docs/en/about-claude/pricing",
      "sourceLabel": "Claude API pricing"
    },
    {
      "id": "anthropic:claude-sonnet-5:standard",
      "modelId": "claude-sonnet-5",
      "provider": "anthropic",
      "providerLabel": "Anthropic",
      "label": "Claude Sonnet 5",
      "tierLabel": "Standard",
      "inputPerMillionUsd": 2,
      "cachedInputPerMillionUsd": 0.2,
      "cacheWritePerMillionUsd": 2.5,
      "cacheWriteOneHourPerMillionUsd": 4,
      "outputPerMillionUsd": 10,
      "contextWindowTokens": 1000000,
      "region": "Global routing",
      "sourceUrl": "https://platform.claude.com/docs/en/about-claude/pricing",
      "sourceLabel": "Claude API pricing"
    },
    {
      "id": "anthropic:claude-sonnet-4.6:standard",
      "modelId": "claude-sonnet-4-6",
      "provider": "anthropic",
      "providerLabel": "Anthropic",
      "label": "Claude Sonnet 4.6",
      "tierLabel": "Standard",
      "inputPerMillionUsd": 3,
      "cachedInputPerMillionUsd": 0.3,
      "cacheWritePerMillionUsd": 3.75,
      "cacheWriteOneHourPerMillionUsd": 6,
      "outputPerMillionUsd": 15,
      "contextWindowTokens": 1000000,
      "region": "Global routing",
      "sourceUrl": "https://platform.claude.com/docs/en/about-claude/pricing",
      "sourceLabel": "Claude API pricing"
    },
    {
      "id": "anthropic:claude-haiku-4.5:standard",
      "modelId": "claude-haiku-4-5",
      "provider": "anthropic",
      "providerLabel": "Anthropic",
      "label": "Claude Haiku 4.5",
      "tierLabel": "Standard",
      "inputPerMillionUsd": 1,
      "cachedInputPerMillionUsd": 0.1,
      "cacheWritePerMillionUsd": 1.25,
      "cacheWriteOneHourPerMillionUsd": 2,
      "outputPerMillionUsd": 5,
      "contextWindowTokens": 200000,
      "region": "Global routing",
      "sourceUrl": "https://platform.claude.com/docs/en/about-claude/pricing",
      "sourceLabel": "Claude API pricing"
    },
    {
      "id": "google:gemini-3.7-flash:standard:intro",
      "modelId": "gemini-3.7-flash",
      "provider": "google",
      "providerLabel": "Google",
      "label": "Gemini 3.7 Flash",
      "tierLabel": "Developer API · Standard · introductory",
      "inputPerMillionUsd": 0.75,
      "cachedInputPerMillionUsd": 0.075,
      "explicitCacheStoragePerMillionTokenHourUsd": 0.5,
      "outputPerMillionUsd": 3.75,
      "region": "Gemini Developer API",
      "sourceUrl": "https://ai.google.dev/gemini-api/docs/pricing#gemini-3.7-flash",
      "sourceLabel": "Gemini API pricing",
      "effectiveUntil": "2027-01-01T00:00:00Z"
    },
    {
      "id": "google:gemini-3.6-flash:standard:intro",
      "modelId": "gemini-3.6-flash",
      "provider": "google",
      "providerLabel": "Google",
      "label": "Gemini 3.6 Flash",
      "tierLabel": "Developer API · Standard · introductory",
      "inputPerMillionUsd": 0.75,
      "cachedInputPerMillionUsd": 0.075,
      "explicitCacheStoragePerMillionTokenHourUsd": 0.5,
      "outputPerMillionUsd": 3.75,
      "region": "Gemini Developer API",
      "sourceUrl": "https://ai.google.dev/gemini-api/docs/pricing#gemini-3.6-flash",
      "sourceLabel": "Gemini API pricing",
      "effectiveUntil": "2027-01-01T00:00:00Z"
    },
    {
      "id": "google:gemini-3.5-flash:standard",
      "modelId": "gemini-3.5-flash",
      "provider": "google",
      "providerLabel": "Google",
      "label": "Gemini 3.5 Flash",
      "tierLabel": "Developer API · Standard",
      "inputPerMillionUsd": 1.5,
      "cachedInputPerMillionUsd": 0.15,
      "explicitCacheStoragePerMillionTokenHourUsd": 1,
      "outputPerMillionUsd": 9,
      "region": "Gemini Developer API",
      "sourceUrl": "https://ai.google.dev/gemini-api/docs/pricing#gemini-3.5-flash",
      "sourceLabel": "Gemini API pricing"
    },
    {
      "id": "google:gemini-3.5-flash-lite:standard",
      "modelId": "gemini-3.5-flash-lite",
      "provider": "google",
      "providerLabel": "Google",
      "label": "Gemini 3.5 Flash-Lite",
      "tierLabel": "Developer API · Standard",
      "inputPerMillionUsd": 0.3,
      "cachedInputPerMillionUsd": 0.03,
      "explicitCacheStoragePerMillionTokenHourUsd": 1,
      "outputPerMillionUsd": 2.5,
      "region": "Gemini Developer API",
      "sourceUrl": "https://ai.google.dev/gemini-api/docs/pricing#gemini-3.5-flash-lite",
      "sourceLabel": "Gemini API pricing"
    },
    {
      "id": "google:gemini-3.1-flash-lite:standard",